text	kana	fed_text	sources
来週の打合せに参ります。	ライシュウノ'/ウチアワセニ'/マイリマ'_ス	来週の打合せに参ります。	grammar-n4#n4-63
来週までに報告書を提出しなければなりません。	ライシュウマ'デニ/ホオコ_クショオ'/テエ_シュツ'/シナケレ'バ/ナリマセ'ン	来週までに報告書を提出しなければなりません。	grammar-n4#n4-16
来週金曜までに企画書を提出してください。	ライシュウ'/キンヨ'オマデニ/_キカ_クショオ'/テエ_シュツ'/_シテ'/クダサ'イ	来週金曜までに企画書を提出してください。	grammar-n4#n4-1
隣の家は引っ越したようです。	トナリノ'/イエ'ワ/ヒッコ_シタ'/ヨ'オデ_ス	隣の家は引っ越したようです。	grammar-n4#n4-33
鈴木さんは会議に出られないかもしれない。	スズ_キサンワ'/カ'イギニ/デラレナイカモ'/シレナイ'	鈴木さんは会議に出られないかもしれない。	grammar-n4#n4-3
連続ドラマを一晩で見てしまいました。	レンゾクド'ラマオ/_ヒト'バンデ/ミ'テ/シマイマ'_シタ	連続ドラマを一晩で見てしまいました。	grammar-n4#n4-24
